{"blockers":[{"code":"doc.body.bytes.external","description":"Official document bodies and per-page content hashes are not retained."},{"code":"doc.build.replay.missing","description":"Generated Sphinx/manual pages have not been reproduced from the exact release."},{"code":"loss-rendered-build-not-replayed","description":"The provider document projection has an unresolved blocking official-document loss: rendered-build-not-replayed."},{"code":"loss-package-style-and-potential-closure-external","description":"The provider document projection has an unresolved blocking official-document loss: package-style-and-potential-closure-external."}],"contract_name":"document-slice-manifest","corpus_ref":{"corpus_id":"lammps-rigorous-simulations-lammps-docs-official-corpus","sha256":"e242902998b907f5cc0c22de45ae6ca73a662b1900932c25658bc16499361b2d"},"limitations":["Central processor hashes are pinned, but this exact input/output run has no platform attestation.","External raw identity is the SHA-256 of canonical sorted git ls-tree -r receipt lines '<mode> <object_type> <object_id>\\t<path>\\n' for every inventory entry; the local inventory JSON is metadata evidence only and contains no official document body bytes.","The exact documentation-tree inventory does not establish native availability, compiled package/style coverage, command semantics, numerical convergence, or scientific acceptance.","The exact release documentation tree is inventoried as metadata only; document bodies, generated HTML, examples, potentials, and binary help remain external."],"producer":{"generated_utc":"2026-07-23T20:17:38Z","skill_id":"lammps-rigorous-simulations","skill_version":"1.0","tool_id":"official-document-pack-builder","tool_version":"1.0"},"schema_version":"1.0","slice_manifest_id":"lammps-rigorous-simulations-lammps-docs-official-slices","sources":[{"loss_ledger":[{"affected_slice_ids":["lammps-exact-document-tree-inventory.whole"],"category":"other","description":"Only exact Git path and object metadata are retained; documentation bodies remain external.","disposition":"external-only","loss_id":"document-bodies-not-retained","severity":"material"},{"affected_slice_ids":["lammps-exact-document-tree-inventory.whole"],"category":"other","description":"The Sphinx/manual build and generated command pages have not been reproduced from the exact release.","disposition":"unresolved","loss_id":"rendered-build-not-replayed","severity":"blocking"},{"affected_slice_ids":["lammps-exact-document-tree-inventory.whole"],"category":"other","description":"Compiled packages, enabled styles, binary help, potential files, examples, and third-party library behavior are separate release/build/runtime surfaces and remain external.","disposition":"unresolved","loss_id":"package-style-and-potential-closure-external","severity":"blocking"}],"preserved_ranges":[],"raw_source_extent_bytes":129791,"reviewed_orphans":[],"reviewed_overlaps":[],"slices":[{"artifact_kind":"metadata","artifact_sha256":null,"byte_range":null,"content_locator":"https://github.com/lammps/lammps/tree/patch_4Jul2026/doc","content_receipt":{"canonical_url":"https://github.com/lammps/lammps/tree/patch_4Jul2026/doc","evidence_sha256":"d1807595663934d1dbe09adbcb01bfb43dca85c2aa5093b5965dee495276d8ed","raw_bytes":129791,"raw_sha256":"0f29b33a6d02f848d7b133e3e4bffa625c492c48822c3691a3af61ab9e60c4aa","receipt_id":"lammps-rigorous-simulations-lammps-docs-lammps-exact-document-tree-inventory-lammps-exact-document-tree-inventory.whole","registry_path":"registry/official-document-consumers.yaml","registry_sha256":"60bf8d0f3d9596eeac1d9541d5f819d549ac937ab5a6fa5c316f6413d939a99c","resolver_id":"official-document-pack-builder","retrieved_utc":"2026-07-23T20:17:38Z","selected_bytes":129791,"selected_sha256":"0f29b33a6d02f848d7b133e3e4bffa625c492c48822c3691a3af61ab9e60c4aa","selection_attestation_id":null,"trust_id":null,"trust_mode":"unverified","verification_status":"unverified"},"content_sha256":"0f29b33a6d02f848d7b133e3e4bffa625c492c48822c3691a3af61ab9e60c4aa","hash_basis":"external-receipt-content-bytes","loss_ids":["document-bodies-not-retained","rendered-build-not-replayed","package-style-and-potential-closure-external"],"ordinal":0,"selector":{"kind":"whole-source","layer":"raw-source","value":"*"},"slice_id":"lammps-exact-document-tree-inventory.whole","source_material_class":"documentation-text","storage_mode":"metadata-only"}],"source_id":"lammps-exact-document-tree-inventory","source_identity":{"kind":"revision","raw_bytes":129791,"raw_sha256":"0f29b33a6d02f848d7b133e3e4bffa625c492c48822c3691a3af61ab9e60c4aa","resolver_receipt":{"canonical_url":"https://github.com/lammps/lammps/tree/patch_4Jul2026/doc","evidence_sha256":"d1807595663934d1dbe09adbcb01bfb43dca85c2aa5093b5965dee495276d8ed","raw_bytes":129791,"raw_sha256":"0f29b33a6d02f848d7b133e3e4bffa625c492c48822c3691a3af61ab9e60c4aa","receipt_id":"lammps-rigorous-simulations-lammps-docs-lammps-exact-document-tree-inventory-source-receipt","registry_path":"registry/official-document-consumers.yaml","registry_sha256":"60bf8d0f3d9596eeac1d9541d5f819d549ac937ab5a6fa5c316f6413d939a99c","resolver_id":"official-document-pack-builder","retrieved_utc":"2026-07-23T20:17:38Z","selected_bytes":129791,"selected_sha256":"0f29b33a6d02f848d7b133e3e4bffa625c492c48822c3691a3af61ab9e60c4aa","selection_attestation_id":null,"trust_id":null,"trust_mode":"unverified","verification_status":"unverified"},"value":"commit:b54f0e7b0fb0003d6cec2e53c3b222211f4915c0;root-tree:a04915cea3c840acd2a8ed2d9d327ca462ed8dbf"},"transformer":{"attestation_id":null,"configuration_ref":{"path":"contracts/official-document-pack-seed.schema.json","sha256":"82d86a53e420836161b1fe901736d83315c7e265c42f7771e5d8bd8ce9785599"},"dependency_lock_ref":{"path":"contracts/official-document-pack-builder-lock.json","sha256":"48e28868dc2fefaa8ce9631654f01082493c0321bead6be4fbcbc072b4c3d8a9"},"deterministic":true,"implementation_ref":{"path":"tools/build_official_document_packs.py","sha256":"a2c15fc1d2b4c3266544b9a7e64c6f443799f27e87ee12d64a94fb43ea4cf936"},"input_raw_sha256":"0f29b33a6d02f848d7b133e3e4bffa625c492c48822c3691a3af61ab9e60c4aa","output_sha256":"6e673f321d336a0a2453da3a46b42451ccef3bd33ed3483617a4be795a9b202a","transformer_id":"official-document-pack-transformer","transformer_version":"1.0","trust_mode":"central-pinned"}}],"status":"blocked"}
