{"blockers":[{"code":"loss-g16-c02-no-complete-reference","description":"The provider document projection has an unresolved blocking official-document loss: g16-c02-no-complete-reference."}],"contract_name":"document-slice-manifest","corpus_ref":{"corpus_id":"gaussian-rigorous-calculations-gaussian-g16-c02-delta-official-corpus","sha256":"ce8874836c1f2eef9d2b9b39315b154bd175c4edcd63fb86121224a48ade92ac"},"limitations":["C.02 release materials are a delta and do not make the C.01 public user reference version-matched C.02 documentation.","Central processor hashes are pinned, but this exact input/output run has no platform attestation.","Coverage is metadata-only and bounded to five public Gaussian 16 Rev. C.01 WordPress page records plus the public Rev. C.02 release-note record and platform PDF.","Licensed manuals, examples, binaries, basis payloads, checkpoints, user data, calculation artifacts, execution authorization, convergence, and scientific acceptance remain outside this pack.","No licensed manual, installer, binary, example, basis payload, or checkpoint is stored.","The C.01 keyword, IOp, utility, option, and user-reference leaf graph is not completely enumerated or receipt-bound.","The C.02 materials are a release delta and cannot establish a complete version-matched C.02 reference."],"producer":{"generated_utc":"2026-07-23T19:38:20Z","skill_id":"gaussian-rigorous-calculations","skill_version":"1.0","tool_id":"official-document-pack-builder","tool_version":"1.0"},"schema_version":"1.0","slice_manifest_id":"gaussian-rigorous-calculations-gaussian-g16-c02-delta-official-slices","sources":[{"loss_ledger":[{"affected_slice_ids":["g16-c02-release-notes-content"],"category":"other","description":"The public C.02 delta does not provide a complete version-matched C.02 keyword, IOp, input, output, or utility corpus.","disposition":"unresolved","loss_id":"g16-c02-no-complete-reference","severity":"blocking"}],"preserved_ranges":[],"raw_source_extent_bytes":75818,"reviewed_orphans":[],"reviewed_overlaps":[],"slices":[{"artifact_kind":"metadata","artifact_sha256":null,"byte_range":null,"content_locator":"https://gaussian.com/wp-json/wp/v2/pages/15586","content_receipt":{"canonical_url":"https://gaussian.com/wp-json/wp/v2/pages/15586","evidence_sha256":"7a86a8304545d97684f92b5687b33dfa8e8bd8f49ea7c74e9b7baef9dce5fad9","raw_bytes":75818,"raw_sha256":"ac8ffd81d51e2d8031eb55a146682d91dbc490eebf05081ad19a26302d759ea6","receipt_id":"gaussian-rigorous-calculations-gaussian-g16-c02-delta-g16-c02-release-notes-g16-c02-release-notes-content","registry_path":"registry/official-document-consumers.yaml","registry_sha256":"60bf8d0f3d9596eeac1d9541d5f819d549ac937ab5a6fa5c316f6413d939a99c","resolver_id":"official-document-pack-builder","retrieved_utc":"2026-07-23T19:38:20Z","selected_bytes":70403,"selected_sha256":"678e643ddec549f1ef4eae0278f1ce77d02a8276218a94757aa70ca2e9322ff4","selection_attestation_id":null,"trust_id":null,"trust_mode":"unverified","verification_status":"unverified"},"content_sha256":"678e643ddec549f1ef4eae0278f1ce77d02a8276218a94757aa70ca2e9322ff4","hash_basis":"external-receipt-content-bytes","loss_ids":["g16-c02-no-complete-reference"],"ordinal":0,"selector":{"kind":"json-pointer","layer":"raw-source","value":"/content/rendered"},"slice_id":"g16-c02-release-notes-content","source_material_class":"documentation-text","storage_mode":"metadata-only"}],"source_id":"g16-c02-release-notes","source_identity":{"kind":"external-receipt","raw_bytes":75818,"raw_sha256":"ac8ffd81d51e2d8031eb55a146682d91dbc490eebf05081ad19a26302d759ea6","resolver_receipt":{"canonical_url":"https://gaussian.com/wp-json/wp/v2/pages/15586","evidence_sha256":"678e643ddec549f1ef4eae0278f1ce77d02a8276218a94757aa70ca2e9322ff4","raw_bytes":75818,"raw_sha256":"ac8ffd81d51e2d8031eb55a146682d91dbc490eebf05081ad19a26302d759ea6","receipt_id":"gaussian-rigorous-calculations-gaussian-g16-c02-delta-g16-c02-release-notes-source-receipt","registry_path":"registry/official-document-consumers.yaml","registry_sha256":"60bf8d0f3d9596eeac1d9541d5f819d549ac937ab5a6fa5c316f6413d939a99c","resolver_id":"official-document-pack-builder","retrieved_utc":"2026-07-23T19:38:20Z","selected_bytes":75818,"selected_sha256":"ac8ffd81d51e2d8031eb55a146682d91dbc490eebf05081ad19a26302d759ea6","selection_attestation_id":null,"trust_id":null,"trust_mode":"unverified","verification_status":"unverified"},"value":"gaussian-rigorous-calculations-gaussian-g16-c02-delta-g16-c02-release-notes-source-receipt"},"transformer":{"attestation_id":null,"configuration_ref":{"path":"contracts/official-document-pack-seed.schema.json","sha256":"82d86a53e420836161b1fe901736d83315c7e265c42f7771e5d8bd8ce9785599"},"dependency_lock_ref":{"path":"contracts/official-document-pack-builder-lock.json","sha256":"48e28868dc2fefaa8ce9631654f01082493c0321bead6be4fbcbc072b4c3d8a9"},"deterministic":true,"implementation_ref":{"path":"tools/build_official_document_packs.py","sha256":"a2c15fc1d2b4c3266544b9a7e64c6f443799f27e87ee12d64a94fb43ea4cf936"},"input_raw_sha256":"ac8ffd81d51e2d8031eb55a146682d91dbc490eebf05081ad19a26302d759ea6","output_sha256":"04c498a7922fd5d3f0b49f44f027489262bfbc8653b00651c47ff26ee3037a08","transformer_id":"official-document-pack-transformer","transformer_version":"1.0","trust_mode":"central-pinned"}},{"loss_ledger":[{"affected_slice_ids":["g16-c02-platform-list-pdf"],"category":"other","description":"The public C.02 delta does not provide a complete version-matched C.02 keyword, IOp, input, output, or utility corpus.","disposition":"unresolved","loss_id":"g16-c02-no-complete-reference","severity":"blocking"}],"preserved_ranges":[],"raw_source_extent_bytes":237846,"reviewed_orphans":[],"reviewed_overlaps":[],"slices":[{"artifact_kind":"metadata","artifact_sha256":null,"byte_range":null,"content_locator":"https://gaussian.com/g16/g16_plat.pdf","content_receipt":{"canonical_url":"https://gaussian.com/g16/g16_plat.pdf","evidence_sha256":"7a86a8304545d97684f92b5687b33dfa8e8bd8f49ea7c74e9b7baef9dce5fad9","raw_bytes":237846,"raw_sha256":"d19685abcb3eba25cd175c228bcd29546f1940e052a4ab3820ffa8c804352b08","receipt_id":"gaussian-rigorous-calculations-gaussian-g16-c02-delta-g16-c02-platform-list-g16-c02-platform-list-pdf","registry_path":"registry/official-document-consumers.yaml","registry_sha256":"60bf8d0f3d9596eeac1d9541d5f819d549ac937ab5a6fa5c316f6413d939a99c","resolver_id":"official-document-pack-builder","retrieved_utc":"2026-07-23T19:36:48Z","selected_bytes":237846,"selected_sha256":"d19685abcb3eba25cd175c228bcd29546f1940e052a4ab3820ffa8c804352b08","selection_attestation_id":null,"trust_id":null,"trust_mode":"unverified","verification_status":"unverified"},"content_sha256":"d19685abcb3eba25cd175c228bcd29546f1940e052a4ab3820ffa8c804352b08","hash_basis":"external-receipt-content-bytes","loss_ids":["g16-c02-no-complete-reference"],"ordinal":0,"selector":{"kind":"whole-source","layer":"raw-source","value":"*"},"slice_id":"g16-c02-platform-list-pdf","source_material_class":"documentation-text","storage_mode":"metadata-only"}],"source_id":"g16-c02-platform-list","source_identity":{"kind":"external-receipt","raw_bytes":237846,"raw_sha256":"d19685abcb3eba25cd175c228bcd29546f1940e052a4ab3820ffa8c804352b08","resolver_receipt":{"canonical_url":"https://gaussian.com/g16/g16_plat.pdf","evidence_sha256":"d19685abcb3eba25cd175c228bcd29546f1940e052a4ab3820ffa8c804352b08","raw_bytes":237846,"raw_sha256":"d19685abcb3eba25cd175c228bcd29546f1940e052a4ab3820ffa8c804352b08","receipt_id":"gaussian-rigorous-calculations-gaussian-g16-c02-delta-g16-c02-platform-list-source-receipt","registry_path":"registry/official-document-consumers.yaml","registry_sha256":"60bf8d0f3d9596eeac1d9541d5f819d549ac937ab5a6fa5c316f6413d939a99c","resolver_id":"official-document-pack-builder","retrieved_utc":"2026-07-23T19:36:48Z","selected_bytes":237846,"selected_sha256":"d19685abcb3eba25cd175c228bcd29546f1940e052a4ab3820ffa8c804352b08","selection_attestation_id":null,"trust_id":null,"trust_mode":"unverified","verification_status":"unverified"},"value":"gaussian-rigorous-calculations-gaussian-g16-c02-delta-g16-c02-platform-list-source-receipt"},"transformer":{"attestation_id":null,"configuration_ref":{"path":"contracts/official-document-pack-seed.schema.json","sha256":"82d86a53e420836161b1fe901736d83315c7e265c42f7771e5d8bd8ce9785599"},"dependency_lock_ref":{"path":"contracts/official-document-pack-builder-lock.json","sha256":"48e28868dc2fefaa8ce9631654f01082493c0321bead6be4fbcbc072b4c3d8a9"},"deterministic":true,"implementation_ref":{"path":"tools/build_official_document_packs.py","sha256":"a2c15fc1d2b4c3266544b9a7e64c6f443799f27e87ee12d64a94fb43ea4cf936"},"input_raw_sha256":"d19685abcb3eba25cd175c228bcd29546f1940e052a4ab3820ffa8c804352b08","output_sha256":"6a2c3bf242ed8f88fe7e602c61867937c05c61134ce232c431b63985bbd0deb9","transformer_id":"official-document-pack-transformer","transformer_version":"1.0","trust_mode":"central-pinned"}}],"status":"blocked"}
