{"blockers":[],"contract_name":"document-slice-manifest","corpus_ref":{"corpus_id":"dft-hpc-execution-json-schema-2020-12-official-corpus","sha256":"7a1e614e879f3d0128a57abad28107353d298d59ba1d6a67920834623bf3eb51"},"limitations":["Central processor hashes are pinned, but this exact input/output run has no platform attestation.","OpenPBS v23.06.06 sources cover a synthetic candidate surface only; they do not activate an OpenPBS operational route.","Slurm receipts identify rolling 26.05 pages at retrieval, not an installed cluster version or site policy.","The pack is metadata-only: scheduler manuals, specifications, and repository contract bodies remain external.","This provider covers the external dialect used by central contract validators, not the candidate CLI's hand-written checks."],"producer":{"generated_utc":"2026-07-23T20:02:38Z","skill_id":"dft-hpc-execution","skill_version":"1.0","tool_id":"official-document-pack-builder","tool_version":"1.0"},"schema_version":"1.0","slice_manifest_id":"dft-hpc-execution-json-schema-2020-12-official-slices","sources":[{"loss_ledger":[{"affected_slice_ids":["json-schema-core-2020-12-whole"],"category":"other","description":"Specification bodies remain external and only exact HTTPS receipts are retained.","disposition":"external-only","loss_id":"json-schema-bodies-external","severity":"material"}],"preserved_ranges":[],"raw_source_extent_bytes":342564,"reviewed_orphans":[],"reviewed_overlaps":[],"slices":[{"artifact_kind":"metadata","artifact_sha256":null,"byte_range":null,"content_locator":"https://json-schema.org/draft/2020-12/json-schema-core.html","content_receipt":{"canonical_url":"https://json-schema.org/draft/2020-12/json-schema-core.html","evidence_sha256":"2ab5b4813e550390c626af4b94c34501b960d09243e4cc366d44337b1fffb8d3","raw_bytes":342564,"raw_sha256":"f8b080be1d8b8eb318ea712c7bad4bf83734b3ee81379baf0c0290292ab5e652","receipt_id":"dft-hpc-execution-json-schema-2020-12-json-schema-core-2020-12-json-schema-core-2020-12-whole","registry_path":"registry/official-document-consumers.yaml","registry_sha256":"60bf8d0f3d9596eeac1d9541d5f819d549ac937ab5a6fa5c316f6413d939a99c","resolver_id":"official-document-pack-builder","retrieved_utc":"2026-07-23T20:02:38Z","selected_bytes":342564,"selected_sha256":"f8b080be1d8b8eb318ea712c7bad4bf83734b3ee81379baf0c0290292ab5e652","selection_attestation_id":null,"trust_id":null,"trust_mode":"unverified","verification_status":"unverified"},"content_sha256":"f8b080be1d8b8eb318ea712c7bad4bf83734b3ee81379baf0c0290292ab5e652","hash_basis":"external-receipt-content-bytes","loss_ids":["json-schema-bodies-external"],"ordinal":0,"selector":{"kind":"whole-source","layer":"raw-source","value":"*"},"slice_id":"json-schema-core-2020-12-whole","source_material_class":"documentation-text","storage_mode":"metadata-only"}],"source_id":"json-schema-core-2020-12","source_identity":{"kind":"external-receipt","raw_bytes":342564,"raw_sha256":"f8b080be1d8b8eb318ea712c7bad4bf83734b3ee81379baf0c0290292ab5e652","resolver_receipt":{"canonical_url":"https://json-schema.org/draft/2020-12/json-schema-core.html","evidence_sha256":"2ab5b4813e550390c626af4b94c34501b960d09243e4cc366d44337b1fffb8d3","raw_bytes":342564,"raw_sha256":"f8b080be1d8b8eb318ea712c7bad4bf83734b3ee81379baf0c0290292ab5e652","receipt_id":"dft-hpc-execution-json-schema-2020-12-json-schema-core-2020-12-source-receipt","registry_path":"registry/official-document-consumers.yaml","registry_sha256":"60bf8d0f3d9596eeac1d9541d5f819d549ac937ab5a6fa5c316f6413d939a99c","resolver_id":"official-document-pack-builder","retrieved_utc":"2026-07-23T20:02:38Z","selected_bytes":342564,"selected_sha256":"f8b080be1d8b8eb318ea712c7bad4bf83734b3ee81379baf0c0290292ab5e652","selection_attestation_id":null,"trust_id":null,"trust_mode":"unverified","verification_status":"unverified"},"value":"dft-hpc-execution-json-schema-2020-12-json-schema-core-2020-12-source-receipt"},"transformer":{"attestation_id":null,"configuration_ref":{"path":"contracts/official-document-pack-seed.schema.json","sha256":"82d86a53e420836161b1fe901736d83315c7e265c42f7771e5d8bd8ce9785599"},"dependency_lock_ref":{"path":"contracts/official-document-pack-builder-lock.json","sha256":"48e28868dc2fefaa8ce9631654f01082493c0321bead6be4fbcbc072b4c3d8a9"},"deterministic":true,"implementation_ref":{"path":"tools/build_official_document_packs.py","sha256":"a2c15fc1d2b4c3266544b9a7e64c6f443799f27e87ee12d64a94fb43ea4cf936"},"input_raw_sha256":"f8b080be1d8b8eb318ea712c7bad4bf83734b3ee81379baf0c0290292ab5e652","output_sha256":"6207ff692444e29bf180958eb30f7b17e9e1dde3103c73019688c6e96a2bcbea","transformer_id":"official-document-pack-transformer","transformer_version":"1.0","trust_mode":"central-pinned"}},{"loss_ledger":[{"affected_slice_ids":["json-schema-validation-2020-12-whole"],"category":"other","description":"Specification bodies remain external and only exact HTTPS receipts are retained.","disposition":"external-only","loss_id":"json-schema-bodies-external","severity":"material"}],"preserved_ranges":[],"raw_source_extent_bytes":169423,"reviewed_orphans":[],"reviewed_overlaps":[],"slices":[{"artifact_kind":"metadata","artifact_sha256":null,"byte_range":null,"content_locator":"https://json-schema.org/draft/2020-12/json-schema-validation.html","content_receipt":{"canonical_url":"https://json-schema.org/draft/2020-12/json-schema-validation.html","evidence_sha256":"2ab5b4813e550390c626af4b94c34501b960d09243e4cc366d44337b1fffb8d3","raw_bytes":169423,"raw_sha256":"ad91ab6839d7b1f1209c496663c90e406a4530fe333d3e7aade0968e8c590f2f","receipt_id":"dft-hpc-execution-json-schema-2020-12-json-schema-validation-2020-12-json-schema-validation-2020-12-whole","registry_path":"registry/official-document-consumers.yaml","registry_sha256":"60bf8d0f3d9596eeac1d9541d5f819d549ac937ab5a6fa5c316f6413d939a99c","resolver_id":"official-document-pack-builder","retrieved_utc":"2026-07-23T20:02:38Z","selected_bytes":169423,"selected_sha256":"ad91ab6839d7b1f1209c496663c90e406a4530fe333d3e7aade0968e8c590f2f","selection_attestation_id":null,"trust_id":null,"trust_mode":"unverified","verification_status":"unverified"},"content_sha256":"ad91ab6839d7b1f1209c496663c90e406a4530fe333d3e7aade0968e8c590f2f","hash_basis":"external-receipt-content-bytes","loss_ids":["json-schema-bodies-external"],"ordinal":0,"selector":{"kind":"whole-source","layer":"raw-source","value":"*"},"slice_id":"json-schema-validation-2020-12-whole","source_material_class":"documentation-text","storage_mode":"metadata-only"}],"source_id":"json-schema-validation-2020-12","source_identity":{"kind":"external-receipt","raw_bytes":169423,"raw_sha256":"ad91ab6839d7b1f1209c496663c90e406a4530fe333d3e7aade0968e8c590f2f","resolver_receipt":{"canonical_url":"https://json-schema.org/draft/2020-12/json-schema-validation.html","evidence_sha256":"2ab5b4813e550390c626af4b94c34501b960d09243e4cc366d44337b1fffb8d3","raw_bytes":169423,"raw_sha256":"ad91ab6839d7b1f1209c496663c90e406a4530fe333d3e7aade0968e8c590f2f","receipt_id":"dft-hpc-execution-json-schema-2020-12-json-schema-validation-2020-12-source-receipt","registry_path":"registry/official-document-consumers.yaml","registry_sha256":"60bf8d0f3d9596eeac1d9541d5f819d549ac937ab5a6fa5c316f6413d939a99c","resolver_id":"official-document-pack-builder","retrieved_utc":"2026-07-23T20:02:38Z","selected_bytes":169423,"selected_sha256":"ad91ab6839d7b1f1209c496663c90e406a4530fe333d3e7aade0968e8c590f2f","selection_attestation_id":null,"trust_id":null,"trust_mode":"unverified","verification_status":"unverified"},"value":"dft-hpc-execution-json-schema-2020-12-json-schema-validation-2020-12-source-receipt"},"transformer":{"attestation_id":null,"configuration_ref":{"path":"contracts/official-document-pack-seed.schema.json","sha256":"82d86a53e420836161b1fe901736d83315c7e265c42f7771e5d8bd8ce9785599"},"dependency_lock_ref":{"path":"contracts/official-document-pack-builder-lock.json","sha256":"48e28868dc2fefaa8ce9631654f01082493c0321bead6be4fbcbc072b4c3d8a9"},"deterministic":true,"implementation_ref":{"path":"tools/build_official_document_packs.py","sha256":"a2c15fc1d2b4c3266544b9a7e64c6f443799f27e87ee12d64a94fb43ea4cf936"},"input_raw_sha256":"ad91ab6839d7b1f1209c496663c90e406a4530fe333d3e7aade0968e8c590f2f","output_sha256":"7f048b16cd7be096d93a74f9be84c3be090f93fd87488c596ffd2dcbb68bee33","transformer_id":"official-document-pack-transformer","transformer_version":"1.0","trust_mode":"central-pinned"}}],"status":"partial"}
